{
  "$schema": "https://json-schema.org/draft/2020-12/schema",
  "description": "model.json describes a number of devices, typically lights, for use within the HomeAssistant Powercalc extension.",
  "type": "object",
  "required": [
    "name",
    "standby_power",
    "measure_method",
    "measure_device",
    "supported_modes"
  ],
  "properties": {
    "name": {
      "type": "string",
      "description": "The full name"
    },
    "standby_power": {
      "type": "number",
      "minimum": 0.05,
      "description": "Power draw when the device is turned off. When you are not able to measure set to 0.4 for lights"
    },
    "standby_power_on": {
      "type": "number",
      "minimum": 0.05,
      "description": "Power draw when the device is turned on."
    },
    "supported_modes": {
      "type": "array",
      "minItems": 1,
      "items": {
        "type": "string",
        "enum": ["lut", "linear", "fixed"]
      },
      "description": "Supported calculation modes"
    },
    "measure_method": {
      "type": "string",
      "enum": ["manual", "script"],
      "description": "How the device was measured"
    },
    "measure_device": {
      "type": "string",
      "description": "Device which was used to measure"
    },
    "measure_description": {
      "type": "string",
      "description": "Add more information about how you measured the device or any remarks"
    },
    "measure_settings": {
      "type": "object",
      "description": "Settings used for measure script"
    },
    "linked_lut": {
      "type": "string",
      "description": "Use LUT data files from another model"
    },
    "requires_additional_configuration": {
      "type": "boolean",
      "description": "Defines whether this model needs additional configuration by the user. Used for smart switches and lights where we can only know the standby power, but not the power of connected light bulb"
    },
    "device_type": {
      "type": "string",
      "enum": ["light", "smart_switch"],
      "description": "Type of device"
    },
    "calculation_enabled_condition": {
      "type": "string",
      "description": "Template which can be evaluated."
    },
    "aliases": {
      "type": "array",
      "items": {
        "type": "string"
      },
      "description": "Aliases for this model"
    },
    "linear_config": {
      "type": "object",
      "description": "Configuration for linear calculation mode",
      "properties": {
        "min_watt": {
          "type": "number"
        },
        "max_watt": {
          "type": "number"
        }
      }
    },
    "fixed_config": {
      "type": "object",
      "description": "Configuration for fixed calculation mode",
      "properties": {
        "watt": {
          "type": "number"
        }
      }
    },
    "sensor_config": {
      "type": "object",
      "description": "Sensor configuration options. See the README"
    }
  }
}
