{
    "measure_description": "Measured with utils/measure script",
    "measure_device": "Sonoff S31",
    "measure_method": "script",
    "measure_settings": {
        "SAMPLE_COUNT": 3,
        "SLEEP_TIME": 5,
        "VERSION": "master"
    },
    "name": "Treatlife SL20",
    "standby_power": 0.1,
    "supported_modes": [
        "lut"
    ]
}