{
    "name": "RS125 GU10 350lm 2700K",
    "standby_power": 0.38,
    "supported_modes": [
        "lut"
    ],
    "measure_method": "manual",
    "measure_device": "Power Recorder; PR10-D (Model); Shenzen Zhurui Technology (Manufacturer)",
    "measure_description": "Bulbs was measured twice at each dim setting (100 points) and mean value was used when there were differences"
}
