{
    "measure_description": "Measured with utils/measure script",
    "measure_device": "Shelly Plug S",
    "measure_method": "script",
    "measure_settings": {
        "SAMPLE_COUNT": 1,
        "SLEEP_TIME": 2,
        "VERSION": "v0.18.4:docker"
    },
    "name": "Hue Being Pendant Light",
    "standby_power": 0.38,
    "supported_modes": [
        "lut"
    ],
    "aliases": []
}
