{
    "measure_description": "Measured 3 bulbs with utils/measure script with no dummy load",
    "measure_device": "Kasa KP115",
    "measure_method": "script",
    "measure_settings": {
        "SAMPLE_COUNT": 2,
        "SLEEP_TIME": 5,
        "VERSION": "master"
    },
    "name": "Wiz Filament ST19 E26 Transparent (type SHDW9, model 9290022662, 3.8W 120V)",
    "standby_power": 0.38,
    "supported_modes": [
        "lut"
    ]
}