{
    "measure_description": "Measured with utils/measure script",
    "measure_device": "Shelly Plug S",
    "measure_method": "script",
    "measure_settings": {
        "SAMPLE_COUNT": 2,
        "SLEEP_TIME": 3,
        "VERSION": "master"
    },
    "name": "Elgato Key Light Air",
    "standby_power": 0.41,
    "supported_modes": [
        "lut"
    ]
}